<?xml version="1.0" encoding="UTF-8" ?>
<redis-search xmlns:xsi="http://www.w3.org/2001/XMLSchema-instance" xsi:noNamespaceSchemaLocation="https://github.com/MacFJA/php-redisearch-integration/blob/main/src/Xml/schema.xsd">
    <class name="MacFJA\RediSearch\Integration\tests\fixtures\xml\Person" indexname="person" documentprefix="document-id-">
        <id type="property">id</id>
        <stops-words>
            <word>the</word>
            <word>redis</word>
        </stops-words>
        <fields>
            <text-field nostem="false" weight="1.0" phonetic="fr" sortable="true" noindex="false">firstname</text-field>
            <numeric-field property="age" sortable="false" noindex="false">age</numeric-field>
            <tag-field getter="getSkills" separator="|" sortable="false" noindex="false">skill</tag-field>
            <geo-field getter="getCoordinate" noindex="false">address</geo-field>
        </fields>
        <suggestions>
            <property name="firstname" type="word" payload="type:firstname" score="0.5" group="nameSuggestion" />
            <getter name="getLastname" type="full" group="nameSuggestion" />
            <getter name="getCity" type="full" />
        </suggestions>
    </class>
</redis-search>